{
  "id": "waiting-user-provider-policy",
  "type": "decision-record",
  "title": "Wait for operator authorization before enabling external channel access",
  "owner": "operator",
  "decision_owner": "operator",
  "executor": "moss",
  "status": "waiting_user",
  "scope": "External messaging/provider access requires explicit operator authorization before any implementation or test side effect.",
  "source_refs": ["file:docs/architecture/kanban-workflow.md"],
  "artifact_refs": [],
  "evidence_refs": ["summary:external-channel-access-not-enabled"],
  "blocker_cause": "Human authorization is required for externally visible side effects.",
  "next_action": "Operator decides whether to authorize a scoped provider/channel test.",
  "unblock_condition": "A public-safe decision record names the authorized channel, scope, and rollback path.",
  "risk": "high",
  "private_data_level": "public",
  "requires_human_authorization": true,
  "created_at": "2026-05-21T18:45:00Z",
  "updated_at": "2026-05-21T18:45:00Z"
}
