{
  "id": "migrate-moss-contracts",
  "type": "migration-task",
  "title": "Create Moss public operating contracts",
  "owner": "moss",
  "decision_owner": "moss",
  "executor": "moss",
  "status": "done",
  "scope": "Add public-safe Moss contracts under agents/moss/contracts.",
  "source_refs": ["file:docs/architecture/system-overview.md"],
  "artifact_refs": ["file:agents/moss/contracts/operating-contract.md"],
  "evidence_refs": ["test:tests/validate-schemas.sh", "summary:public-contracts-created"],
  "commit_refs": ["997bfed"],
  "risk": "low",
  "private_data_level": "public",
  "requires_human_authorization": false,
  "created_at": "2026-05-21T00:00:00Z",
  "updated_at": "2026-05-21T00:00:00Z",
  "closed_at": "2026-05-21T00:00:00Z"
}
